action_type,activity_comment,activity_id,activity_properties,assay_chembl_id,assay_description,assay_type,assay_variant_accession,assay_variant_mutation,bao_endpoint,bao_format,bao_label,canonical_smiles,data_validity_comment,data_validity_description,document_chembl_id,document_journal,document_year,ligand_efficiency,molecule_chembl_id,molecule_pref_name,parent_molecule_chembl_id,pchembl_value,potential_duplicate,qudt_units,record_id,relation,src_id,standard_flag,standard_relation,standard_text_value,standard_type,standard_units,standard_upper_value,standard_value,target_chembl_id,target_organism,target_pref_name,target_tax_id,text_value,toid,type,units,uo_units,upper_value,value
,,12644470,[],CHEMBL2330714,Inhibition of PARP1/PARP2 in human SKOV3 cells assessed as reduction in H2O2-induced PARylation incubated for 4 hrs prior to H2O2 treatment,B,,,BAO_0000190,BAO_0000219,cell-based format,O=C1CC2c3c(cccc31)CCN2C(=O)c1cc(Cc2n[nH]c(=O)c3ccccc23)ccc1F,,,CHEMBL2321760,J Med Chem,2013,"{'bei': '20.53', 'le': '0.37', 'lle': '5.33', 'sei': '11.20'}",CHEMBL2323226,,CHEMBL2323226,9.31,0,http://www.openphacts.org/units/Nanomolar,1849098,=,1,1,=,,IC50,nM,,0.49,CHEMBL3390820,Homo sapiens,"PARP 1, 2 and 3",9606,,,IC50,nM,UO_0000065,,0.49
,,12644471,[],CHEMBL2330714,Inhibition of PARP1/PARP2 in human SKOV3 cells assessed as reduction in H2O2-induced PARylation incubated for 4 hrs prior to H2O2 treatment,B,,,BAO_0000190,BAO_0000219,cell-based format,O=C1NCC2c3c(cccc31)CCN2C(=O)c1cc(Cc2n[nH]c(=O)c3ccccc23)ccc1F,,,CHEMBL2321760,J Med Chem,2013,"{'bei': '15.33', 'le': '0.28', 'lle': '4.04', 'sei': '7.54'}",CHEMBL2322618,,CHEMBL2322618,7.18,0,http://www.openphacts.org/units/Nanomolar,1848417,=,1,1,=,,IC50,nM,,66.1,CHEMBL3390820,Homo sapiens,"PARP 1, 2 and 3",9606,,,IC50,nM,UO_0000065,,66.1
,,12644472,[],CHEMBL2330714,Inhibition of PARP1/PARP2 in human SKOV3 cells assessed as reduction in H2O2-induced PARylation incubated for 4 hrs prior to H2O2 treatment,B,,,BAO_0000190,BAO_0000219,cell-based format,O=C(c1cc(Cc2n[nH]c(=O)c3ccccc23)ccc1F)N1CCN(C(=O)C2CC2)CC1,,,CHEMBL2321760,J Med Chem,2013,"{'bei': '17.68', 'le': '0.33', 'lle': '5.33', 'sei': '8.89'}",CHEMBL521686,OLAPARIB,CHEMBL521686,7.68,0,http://www.openphacts.org/units/Nanomolar,1848416,=,1,1,=,,IC50,nM,,20.9,CHEMBL3390820,Homo sapiens,"PARP 1, 2 and 3",9606,,,IC50,nM,UO_0000065,,20.9
,,15251076,[],CHEMBL3429594,Inhibition of PARP in human A2780 cells assessed as inhibition of hydrogen peroxide-induced PARylation by cell-based assay,B,,,BAO_0000190,BAO_0000219,cell-based format,NC(=O)c1cccc2cn(-c3ccc([C@@H]4CCCNC4)cc3)nc12,,,CHEMBL3425485,J Med Chem,2015,"{'bei': '26.21', 'le': '0.48', 'lle': '5.81', 'sei': '11.51'}",CHEMBL1094636,NIRAPARIB,CHEMBL1094636,8.40,0,http://www.openphacts.org/units/Nanomolar,2298102,=,1,1,=,,IC50,nM,,4.0,CHEMBL3390820,Homo sapiens,"PARP 1, 2 and 3",9606,,,IC50,nM,UO_0000065,,4.0
,,15251078,[],CHEMBL3429595,Inhibition of PARP in BRCA2-deficient human CAPAN-1 cells assessed as inhibition of hydrogen peroxide-induced PARylation by cell-based assay,B,,,BAO_0000190,BAO_0000219,cell-based format,NC(=O)c1cccc2cn(-c3ccc([C@@H]4CCCNC4)cc3)nc12,,,CHEMBL3425485,J Med Chem,2015,"{'bei': '26.39', 'le': '0.48', 'lle': '5.87', 'sei': '11.59'}",CHEMBL1094636,NIRAPARIB,CHEMBL1094636,8.46,0,http://www.openphacts.org/units/Nanomolar,2298102,=,1,1,=,,IC50,nM,,3.5,CHEMBL3390820,Homo sapiens,"PARP 1, 2 and 3",9606,,,IC50,nM,UO_0000065,,3.5
